{
  "provider": "Example Threat Intel",
  "feed_code": "example-malware",
  "license_name": "Example Commercial Feed License",
  "license_url": "https://feeds.example.com/license",
  "commercial_use_basis": "Commercial redistribution licensed under contract TEST-ONLY.",
  "attribution": null,
  "source_url": "https://feeds.example.com/malware-domains.txt",
  "format": "domain_list",
  "categories": [
    "malware",
    "phishing"
  ],
  "content_sha256": "7777777777777777777777777777777777777777777777777777777777777777",
  "max_size_bytes": "52428800",
  "valid_from": "2026-10-28T00:00:00Z",
  "valid_until": "2026-11-28T00:00:00Z",
  "update_interval_seconds": 3600
}
